{
  "$schema": "../schema/app.schema.json",
  "schemaVersion": 1,
  "packageName": "com.example.changingrequirements",
  "name": "Example Changing Requirements",
  "categories": [
    "payment",
    "government"
  ],
  "compatible": true,
  "history": [
    {
      "date": "2026-01-15",
      "profile": "Main",
      "compatible": true,
      "appVersion": "1.0.0",
      "versionCode": 100,
      "grapheneOSVersion": "2026011501",
      "androidVersion": 16,
      "requirements": {
        "gms": true,
        "gmsForNotifications": true,
        "tee": true,
        "playIntegrity": null,
        "exploitProtectionCompatibilityMode": false
      },
      "notes": "舊版只確認核心功能與通知需要 GMS。"
    },
    {
      "date": "2026-10-12",
      "profile": "Work",
      "compatible": true,
      "appVersion": "2.0.0",
      "versionCode": 200,
      "grapheneOSVersion": "2026100601",
      "androidVersion": 17,
      "requirements": {
        "gms": true,
        "gmsForNotifications": true,
        "tee": true,
        "playIntegrity": true,
        "exploitProtectionCompatibilityMode": false
      },
      "notes": "新版開始要求最低層級的 Play Integrity。"
    }
  ],
  "lastVerified": "2026-10-12",
  "notes": "需求摘要以最新一筆測試歷史為準。"
}
