{
  "$schema": "../schema/app.schema.json",
  "schemaVersion": 1,
  "packageName": "tw.com.familygourmet.FIGapp",
  "name": "享聚卡",
  "categories": [
    "payment"
  ],
  "compatible": true,
  "history": [
    {
      "date": "2026-10-12",
      "profile": null,
      "compatible": true,
      "appVersion": "2.6",
      "versionCode": 34,
      "grapheneOSVersion": "2026100601",
      "androidVersion": 17,
      "requirements": {
        "gms": null,
        "gmsForNotifications": null,
        "tee": null,
        "playIntegrity": false,
        "exploitProtectionCompatibilityMode": false
      },
      "notes": "看起來很正常，沒有明顯依賴 GMS 的功能。"
    }
  ],
  "lastVerified": "2026-10-12",
  "notes": "看起來很正常，沒有明顯依賴 GMS 的功能。"
}
