{
  "$schema": "../schema/app.schema.json",
  "schemaVersion": 1,
  "packageName": "com.wowprimeapp.app",
  "name": "王品瘋美食",
  "categories": [
    "payment"
  ],
  "compatible": true,
  "history": [
    {
      "date": "2026-10-13",
      "profile": null,
      "compatible": true,
      "appVersion": "2.3.14",
      "versionCode": 90,
      "grapheneOSVersion": "2026100601",
      "androidVersion": 17,
      "requirements": {
        "gms": false,
        "gmsForNotifications": true,
        "tee": false,
        "playIntegrity": false,
        "exploitProtectionCompatibilityMode": false
      },
      "notes": ""
    }
  ],
  "lastVerified": "2026-10-13",
  "notes": ""
}
