{
  "$schema": "../schema/app.schema.json",
  "schemaVersion": 1,
  "packageName": "com.unipcsc.uniopen",
  "name": "uniopen",
  "categories": [
    "other"
  ],
  "compatible": true,
  "history": [
    {
      "date": "2026-10-14",
      "profile": null,
      "compatible": true,
      "appVersion": "1.16.0",
      "versionCode": 218,
      "grapheneOSVersion": "2026100601",
      "androidVersion": 17,
      "requirements": {
        "gms": null,
        "gmsForNotifications": true,
        "tee": false,
        "playIntegrity": false,
        "exploitProtectionCompatibilityMode": false
      },
      "notes": "僅通知與地圖依賴 GMS，不影響使用。"
    }
  ],
  "lastVerified": "2026-10-14",
  "notes": "僅通知與地圖依賴 GMS，不影響使用。"
}
